{
  "kind": "reeval-analysis",
  "schemaVersion": 1,
  "scope": {
    "kind": "run",
    "head": "20261016T082407Z_36a6749_cursor-agent_mc00",
    "base": null,
    "evals": null
  },
  "anchor": "20261016T082407Z_36a6749_cursor-agent_mc00",
  "inputs": {
    "records": [
      {
        "runId": "20261016T082407Z_36a6749_cursor-agent_mc00",
        "sha256": "ac21e04c2a411cc0c575ef19e72bc81f7c421ee02ac8d5d87549b00660b53533"
      }
    ],
    "digestVersion": 7,
    "digestHash": "8b4b0c621fa295fc59aa4e9a456d853f0c553559a7401c13af2a1ca086b669b8"
  },
  "promptVersion": "analysis-v9",
  "author": "cursor-agent",
  "model": "fake",
  "resolvedModel": "fake-analysis",
  "route": "fake",
  "usage": {
    "inputTokens": 0,
    "outputTokens": 0
  },
  "latencyMs": 10,
  "createdAt": "2026-10-16T08:24:34.843Z",
  "validation": {
    "citations": 4,
    "invalid": [],
    "dropped": 0,
    "commands": 1,
    "invalidCommands": [],
    "unverifiedNumbers": 0
  },
  "analysis": {
    "tldr": "The house-style skill lifts the pass rate.",
    "whatHappened": [
      {
        "text": "Every eval ran on two harnesses.",
        "cites": [
          "F1"
        ],
        "confidence": "high"
      }
    ],
    "results": [
      {
        "text": "The variant passed where the control failed.",
        "cites": [
          "F1"
        ],
        "confidence": "medium"
      }
    ],
    "why": [],
    "anomalies": [
      {
        "text": "The broken harness never started.",
        "kind": "noise",
        "cites": [
          "F1"
        ]
      }
    ],
    "actions": [
      {
        "title": "Rerun the compare",
        "target": "evals/skill.eval.ts",
        "kind": "eval",
        "change": "Run it three times.",
        "expectedEffect": "A tighter interval.",
        "verify": "reeval run skill --runs 3",
        "impact": "medium",
        "effort": "low",
        "cites": [
          "F1"
        ]
      }
    ],
    "confidence": {
      "overall": "medium",
      "why": "One run."
    }
  },
  "attempts": {
    "r1/greet-1/fake:control#1": {
      "runId": "20261016T082407Z_36a6749_cursor-agent_mc00",
      "evalSlug": "evals-greet-eval-ts-writes-greet-js-df720a",
      "attempt": "fake/fake/fake#1"
    },
    "r1/greet-1/broken:control#1": {
      "runId": "20261016T082407Z_36a6749_cursor-agent_mc00",
      "evalSlug": "evals-greet-eval-ts-writes-greet-js-df720a",
      "attempt": "broken/fake/fake#1"
    },
    "r1/greet-2/fake:control#1": {
      "runId": "20261016T082407Z_36a6749_cursor-agent_mc00",
      "evalSlug": "evals-greet-eval-ts-fails-its-check-e6642c",
      "attempt": "fake/fake/fake#1"
    },
    "r1/greet-2/broken:control#1": {
      "runId": "20261016T082407Z_36a6749_cursor-agent_mc00",
      "evalSlug": "evals-greet-eval-ts-fails-its-check-e6642c",
      "attempt": "broken/fake/fake#1"
    },
    "r1/greet-3/fake:control#1": {
      "runId": "20261016T082407Z_36a6749_cursor-agent_mc00",
      "evalSlug": "evals-greet-eval-ts-fails-its-judge-d8c87c",
      "attempt": "fake/fake/fake#1"
    },
    "r1/greet-3/broken:control#1": {
      "runId": "20261016T082407Z_36a6749_cursor-agent_mc00",
      "evalSlug": "evals-greet-eval-ts-fails-its-judge-d8c87c",
      "attempt": "broken/fake/fake#1"
    },
    "r1/greet-4/fake:control#1": {
      "runId": "20261016T082407Z_36a6749_cursor-agent_mc00",
      "evalSlug": "evals-greet-eval-ts-is-skipped-for-now-9cda2b",
      "attempt": "fake/fake/fake#1"
    },
    "r1/greet-4/broken:control#1": {
      "runId": "20261016T082407Z_36a6749_cursor-agent_mc00",
      "evalSlug": "evals-greet-eval-ts-is-skipped-for-now-9cda2b",
      "attempt": "broken/fake/fake#1"
    },
    "r1/greet-5/control#1": {
      "runId": "20261016T082407Z_36a6749_cursor-agent_mc00",
      "evalSlug": "evals-greet-eval-ts-greets-in-welsh-bd390d",
      "attempt": "unknown#1"
    },
    "r1/skill-1/fake:control#1": {
      "runId": "20261016T082407Z_36a6749_cursor-agent_mc00",
      "evalSlug": "evals-skill-eval-ts-house-greeting-greets-in-the-house-style-81811f",
      "attempt": "fake/plain/docker#1"
    },
    "r1/skill-1/fake:with-house-greeting#1": {
      "runId": "20261016T082407Z_36a6749_cursor-agent_mc00",
      "evalSlug": "evals-skill-eval-ts-house-greeting-greets-in-the-house-style-81811f",
      "attempt": "fake/with-house-greeting/docker#1"
    },
    "r1/skill-1/broken:control#1": {
      "runId": "20261016T082407Z_36a6749_cursor-agent_mc00",
      "evalSlug": "evals-skill-eval-ts-house-greeting-greets-in-the-house-style-81811f",
      "attempt": "broken/plain/docker#1"
    },
    "r1/skill-1/broken:with-house-greeting#1": {
      "runId": "20261016T082407Z_36a6749_cursor-agent_mc00",
      "evalSlug": "evals-skill-eval-ts-house-greeting-greets-in-the-house-style-81811f",
      "attempt": "broken/with-house-greeting/docker#1"
    },
    "r1/skill-2/fake:control#1": {
      "runId": "20261016T082407Z_36a6749_cursor-agent_mc00",
      "evalSlug": "evals-skill-eval-ts-house-greeting-writes-a-greeting-2c149c",
      "attempt": "fake/plain/docker#1"
    },
    "r1/skill-2/fake:with-house-greeting#1": {
      "runId": "20261016T082407Z_36a6749_cursor-agent_mc00",
      "evalSlug": "evals-skill-eval-ts-house-greeting-writes-a-greeting-2c149c",
      "attempt": "fake/with-house-greeting/docker#1"
    },
    "r1/skill-2/broken:control#1": {
      "runId": "20261016T082407Z_36a6749_cursor-agent_mc00",
      "evalSlug": "evals-skill-eval-ts-house-greeting-writes-a-greeting-2c149c",
      "attempt": "broken/plain/docker#1"
    },
    "r1/skill-2/broken:with-house-greeting#1": {
      "runId": "20261016T082407Z_36a6749_cursor-agent_mc00",
      "evalSlug": "evals-skill-eval-ts-house-greeting-writes-a-greeting-2c149c",
      "attempt": "broken/with-house-greeting/docker#1"
    }
  },
  "cited": {
    "F1": "{\"kind\":\"pass-rate\",\"run\":\"r1\",\"eval\":\"greet-1\",\"cells\":[{\"cell\":\"fake:control\",\"pass\":\"1/1\",\"gated\":true},{\"cell\":\"broken:control\",\"pass\":\"0/0\",\"infraError\":1,\"gated\":true}]}"
  }
}
