{
  "kind": "reeval-analysis",
  "schemaVersion": 1,
  "scope": {
    "kind": "run",
    "head": "20261021T090828Z_a5c034d_cursor-agent_vzyz",
    "base": null,
    "evals": null
  },
  "anchor": "20261021T090828Z_a5c034d_cursor-agent_vzyz",
  "inputs": {
    "records": [
      {
        "runId": "20261021T090828Z_a5c034d_cursor-agent_vzyz",
        "sha256": "28fe25536c781f07f58a49c67bda6347efa4989247b1554c4cfd7d5669bbddab"
      }
    ],
    "digestVersion": 10,
    "digestHash": "ecef032234dec41bb97ffa42b6b3ce6959e9d6aece0505f58fc0becd0d62a842"
  },
  "promptVersion": "analysis-v10",
  "author": "cursor-agent",
  "model": "fake",
  "resolvedModel": "fake-analysis",
  "route": "fake",
  "usage": {
    "inputTokens": 0,
    "outputTokens": 0
  },
  "latencyMs": 9,
  "createdAt": "2026-10-21T09:08:59.346Z",
  "validation": {
    "citations": 4,
    "invalid": [],
    "dropped": 0,
    "commands": 1,
    "invalidCommands": [],
    "unverifiedNumbers": 0
  },
  "analysis": {
    "tldr": "The house-style skill lifts the pass rate.",
    "whatHappened": [
      {
        "text": "Every eval ran on two harnesses.",
        "cites": [
          "F1"
        ],
        "confidence": "high"
      }
    ],
    "results": [
      {
        "text": "The variant passed where the control failed.",
        "cites": [
          "F1"
        ],
        "confidence": "medium"
      }
    ],
    "why": [],
    "anomalies": [
      {
        "text": "The broken harness never started.",
        "kind": "noise",
        "cites": [
          "F1"
        ]
      }
    ],
    "actions": [
      {
        "title": "Rerun the compare",
        "target": "evals/skill.eval.ts",
        "kind": "eval",
        "change": "Run it three times.",
        "expectedEffect": "A tighter interval.",
        "verify": "reeval run skill --runs 3",
        "impact": "medium",
        "effort": "low",
        "cites": [
          "F1"
        ]
      }
    ],
    "confidence": {
      "overall": "medium",
      "why": "One run."
    }
  },
  "attempts": {
    "r1/cases-1/fake:control#1": {
      "runId": "20261021T090828Z_a5c034d_cursor-agent_vzyz",
      "evalSlug": "evals-cases-eval-ts-greets-ada-8fa89b",
      "attempt": "fake/plain/docker#1"
    },
    "r1/cases-1/fake:with-house-greeting#1": {
      "runId": "20261021T090828Z_a5c034d_cursor-agent_vzyz",
      "evalSlug": "evals-cases-eval-ts-greets-ada-8fa89b",
      "attempt": "fake/with-house-greeting/docker#1"
    },
    "r1/cases-1/broken:control#1": {
      "runId": "20261021T090828Z_a5c034d_cursor-agent_vzyz",
      "evalSlug": "evals-cases-eval-ts-greets-ada-8fa89b",
      "attempt": "broken/plain/docker#1"
    },
    "r1/cases-1/broken:with-house-greeting#1": {
      "runId": "20261021T090828Z_a5c034d_cursor-agent_vzyz",
      "evalSlug": "evals-cases-eval-ts-greets-ada-8fa89b",
      "attempt": "broken/with-house-greeting/docker#1"
    },
    "r1/cases-2/fake:control#1": {
      "runId": "20261021T090828Z_a5c034d_cursor-agent_vzyz",
      "evalSlug": "evals-cases-eval-ts-greets-grace-76447a",
      "attempt": "fake/plain/docker#1"
    },
    "r1/cases-2/fake:with-house-greeting#1": {
      "runId": "20261021T090828Z_a5c034d_cursor-agent_vzyz",
      "evalSlug": "evals-cases-eval-ts-greets-grace-76447a",
      "attempt": "fake/with-house-greeting/docker#1"
    },
    "r1/cases-2/broken:control#1": {
      "runId": "20261021T090828Z_a5c034d_cursor-agent_vzyz",
      "evalSlug": "evals-cases-eval-ts-greets-grace-76447a",
      "attempt": "broken/plain/docker#1"
    },
    "r1/cases-2/broken:with-house-greeting#1": {
      "runId": "20261021T090828Z_a5c034d_cursor-agent_vzyz",
      "evalSlug": "evals-cases-eval-ts-greets-grace-76447a",
      "attempt": "broken/with-house-greeting/docker#1"
    },
    "r1/cases-3/fake:control#1": {
      "runId": "20261021T090828Z_a5c034d_cursor-agent_vzyz",
      "evalSlug": "evals-cases-eval-ts-writes-greet-js-for-ada-4d85b3",
      "attempt": "fake/fake/fake#1"
    },
    "r1/cases-3/broken:control#1": {
      "runId": "20261021T090828Z_a5c034d_cursor-agent_vzyz",
      "evalSlug": "evals-cases-eval-ts-writes-greet-js-for-ada-4d85b3",
      "attempt": "broken/fake/fake#1"
    },
    "r1/cases-4/fake:control#1": {
      "runId": "20261021T090828Z_a5c034d_cursor-agent_vzyz",
      "evalSlug": "evals-cases-eval-ts-writes-greet-js-for-grace-d92d65",
      "attempt": "fake/fake/fake#1"
    },
    "r1/cases-4/broken:control#1": {
      "runId": "20261021T090828Z_a5c034d_cursor-agent_vzyz",
      "evalSlug": "evals-cases-eval-ts-writes-greet-js-for-grace-d92d65",
      "attempt": "broken/fake/fake#1"
    },
    "r1/greet-1/fake:control#1": {
      "runId": "20261021T090828Z_a5c034d_cursor-agent_vzyz",
      "evalSlug": "evals-greet-eval-ts-writes-greet-js-df720a",
      "attempt": "fake/fake/fake#1"
    },
    "r1/greet-1/broken:control#1": {
      "runId": "20261021T090828Z_a5c034d_cursor-agent_vzyz",
      "evalSlug": "evals-greet-eval-ts-writes-greet-js-df720a",
      "attempt": "broken/fake/fake#1"
    },
    "r1/greet-2/fake:control#1": {
      "runId": "20261021T090828Z_a5c034d_cursor-agent_vzyz",
      "evalSlug": "evals-greet-eval-ts-fails-its-check-e6642c",
      "attempt": "fake/fake/fake#1"
    },
    "r1/greet-2/broken:control#1": {
      "runId": "20261021T090828Z_a5c034d_cursor-agent_vzyz",
      "evalSlug": "evals-greet-eval-ts-fails-its-check-e6642c",
      "attempt": "broken/fake/fake#1"
    },
    "r1/greet-3/fake:control#1": {
      "runId": "20261021T090828Z_a5c034d_cursor-agent_vzyz",
      "evalSlug": "evals-greet-eval-ts-fails-its-judge-d8c87c",
      "attempt": "fake/fake/fake#1"
    },
    "r1/greet-3/broken:control#1": {
      "runId": "20261021T090828Z_a5c034d_cursor-agent_vzyz",
      "evalSlug": "evals-greet-eval-ts-fails-its-judge-d8c87c",
      "attempt": "broken/fake/fake#1"
    },
    "r1/greet-4/fake:control#1": {
      "runId": "20261021T090828Z_a5c034d_cursor-agent_vzyz",
      "evalSlug": "evals-greet-eval-ts-is-skipped-for-now-9cda2b",
      "attempt": "fake/fake/fake#1"
    },
    "r1/greet-4/broken:control#1": {
      "runId": "20261021T090828Z_a5c034d_cursor-agent_vzyz",
      "evalSlug": "evals-greet-eval-ts-is-skipped-for-now-9cda2b",
      "attempt": "broken/fake/fake#1"
    },
    "r1/greet-5/control#1": {
      "runId": "20261021T090828Z_a5c034d_cursor-agent_vzyz",
      "evalSlug": "evals-greet-eval-ts-greets-in-welsh-bd390d",
      "attempt": "unknown#1"
    },
    "r1/skill-1/fake:control#1": {
      "runId": "20261021T090828Z_a5c034d_cursor-agent_vzyz",
      "evalSlug": "evals-skill-eval-ts-house-greeting-greets-in-the-house-style-81811f",
      "attempt": "fake/plain/docker#1"
    },
    "r1/skill-1/fake:with-house-greeting#1": {
      "runId": "20261021T090828Z_a5c034d_cursor-agent_vzyz",
      "evalSlug": "evals-skill-eval-ts-house-greeting-greets-in-the-house-style-81811f",
      "attempt": "fake/with-house-greeting/docker#1"
    },
    "r1/skill-1/broken:control#1": {
      "runId": "20261021T090828Z_a5c034d_cursor-agent_vzyz",
      "evalSlug": "evals-skill-eval-ts-house-greeting-greets-in-the-house-style-81811f",
      "attempt": "broken/plain/docker#1"
    },
    "r1/skill-1/broken:with-house-greeting#1": {
      "runId": "20261021T090828Z_a5c034d_cursor-agent_vzyz",
      "evalSlug": "evals-skill-eval-ts-house-greeting-greets-in-the-house-style-81811f",
      "attempt": "broken/with-house-greeting/docker#1"
    },
    "r1/skill-2/fake:control#1": {
      "runId": "20261021T090828Z_a5c034d_cursor-agent_vzyz",
      "evalSlug": "evals-skill-eval-ts-house-greeting-writes-a-greeting-2c149c",
      "attempt": "fake/plain/docker#1"
    },
    "r1/skill-2/fake:with-house-greeting#1": {
      "runId": "20261021T090828Z_a5c034d_cursor-agent_vzyz",
      "evalSlug": "evals-skill-eval-ts-house-greeting-writes-a-greeting-2c149c",
      "attempt": "fake/with-house-greeting/docker#1"
    },
    "r1/skill-2/broken:control#1": {
      "runId": "20261021T090828Z_a5c034d_cursor-agent_vzyz",
      "evalSlug": "evals-skill-eval-ts-house-greeting-writes-a-greeting-2c149c",
      "attempt": "broken/plain/docker#1"
    },
    "r1/skill-2/broken:with-house-greeting#1": {
      "runId": "20261021T090828Z_a5c034d_cursor-agent_vzyz",
      "evalSlug": "evals-skill-eval-ts-house-greeting-writes-a-greeting-2c149c",
      "attempt": "broken/with-house-greeting/docker#1"
    }
  },
  "cited": {
    "F1": "{\"kind\":\"pass@1\",\"run\":\"r1\",\"eval\":\"cases-1\",\"cells\":[{\"cell\":\"fake:plain (control)\",\"pass\":\"0/1\",\"gated\":false},{\"cell\":\"fake:with-house-greeting\",\"pass\":\"1/1\",\"gated\":true},{\"cell\":\"broken:plain (control)\",\"pass\":\"0/0\",\"infraError\":1,\"gated\":false},{\"cell\":\"broken:with-house-greeting\",\"pass\":\"0/0\",\"infraError\":1,\"gated\":true}],\"family\":\"evals/cases.eval.ts › greets %s\",\"case\":0}"
  }
}
