{
  "kind": "reeval-analysis",
  "schemaVersion": 1,
  "scope": {
    "kind": "run",
    "head": "20260929T222049Z_3bc2e63_cursor-agent_nxyt",
    "base": null,
    "evals": null
  },
  "anchor": "20260929T222049Z_3bc2e63_cursor-agent_nxyt",
  "inputs": {
    "records": [
      {
        "runId": "20260929T222049Z_3bc2e63_cursor-agent_nxyt",
        "sha256": "975b806401e396aa886157da077538d60a9fdd4495e9c1be78b0eda5ecc05990"
      }
    ],
    "digestVersion": 1,
    "digestHash": "8bbf419e4a105227e32928c01ed854914cfd12f7fd937e3c39dbcfa25f30436e"
  },
  "promptVersion": "analysis-v2",
  "model": "fake",
  "resolvedModel": "fake-analysis",
  "route": "fake",
  "usage": {
    "inputTokens": 0,
    "outputTokens": 0
  },
  "latencyMs": 10,
  "createdAt": "2026-09-29T22:20:53.337Z",
  "author": "cursor-agent",
  "validation": {
    "citations": 4,
    "invalid": [],
    "dropped": 0,
    "commands": 1,
    "invalidCommands": [],
    "unverifiedNumbers": 0
  },
  "analysis": {
    "tldr": "The house-style skill lifts the pass rate.",
    "whatHappened": [
      {
        "text": "Every eval ran on two harnesses.",
        "cites": [
          "F1"
        ],
        "confidence": "high"
      }
    ],
    "results": [
      {
        "text": "The variant passed where the control failed.",
        "cites": [
          "F1"
        ],
        "confidence": "medium"
      }
    ],
    "why": [],
    "anomalies": [
      {
        "text": "The broken harness never started.",
        "kind": "noise",
        "cites": [
          "F1"
        ]
      }
    ],
    "actions": [
      {
        "title": "Rerun the compare",
        "target": "evals/skill.eval.ts",
        "kind": "eval",
        "change": "Run it three times.",
        "expectedEffect": "A tighter interval.",
        "verify": "reeval run skill --runs 3",
        "impact": "medium",
        "effort": "low",
        "cites": [
          "F1"
        ]
      }
    ],
    "confidence": {
      "overall": "medium",
      "why": "One run."
    }
  },
  "attempts": {
    "r1/greet-1/fake:control#1": {
      "runId": "20260929T222049Z_3bc2e63_cursor-agent_nxyt",
      "evalSlug": "evals-greet-eval-ts-writes-greet-js-df720a",
      "attempt": "fake/-/fake#1"
    },
    "r1/greet-1/broken:control#1": {
      "runId": "20260929T222049Z_3bc2e63_cursor-agent_nxyt",
      "evalSlug": "evals-greet-eval-ts-writes-greet-js-df720a",
      "attempt": "broken/-/fake#1"
    },
    "r1/greet-2/fake:control#1": {
      "runId": "20260929T222049Z_3bc2e63_cursor-agent_nxyt",
      "evalSlug": "evals-greet-eval-ts-fails-its-check-e6642c",
      "attempt": "fake/-/fake#1"
    },
    "r1/greet-2/broken:control#1": {
      "runId": "20260929T222049Z_3bc2e63_cursor-agent_nxyt",
      "evalSlug": "evals-greet-eval-ts-fails-its-check-e6642c",
      "attempt": "broken/-/fake#1"
    },
    "r1/greet-3/fake:control#1": {
      "runId": "20260929T222049Z_3bc2e63_cursor-agent_nxyt",
      "evalSlug": "evals-greet-eval-ts-fails-its-judge-d8c87c",
      "attempt": "fake/-/fake#1"
    },
    "r1/greet-3/broken:control#1": {
      "runId": "20260929T222049Z_3bc2e63_cursor-agent_nxyt",
      "evalSlug": "evals-greet-eval-ts-fails-its-judge-d8c87c",
      "attempt": "broken/-/fake#1"
    },
    "r1/greet-4/fake:control#1": {
      "runId": "20260929T222049Z_3bc2e63_cursor-agent_nxyt",
      "evalSlug": "evals-greet-eval-ts-is-skipped-for-now-9cda2b",
      "attempt": "fake/-/fake#1"
    },
    "r1/greet-4/broken:control#1": {
      "runId": "20260929T222049Z_3bc2e63_cursor-agent_nxyt",
      "evalSlug": "evals-greet-eval-ts-is-skipped-for-now-9cda2b",
      "attempt": "broken/-/fake#1"
    },
    "r1/greet-5/control#1": {
      "runId": "20260929T222049Z_3bc2e63_cursor-agent_nxyt",
      "evalSlug": "evals-greet-eval-ts-greets-in-welsh-bd390d",
      "attempt": "unknown#1"
    },
    "r1/skill/fake:control#1": {
      "runId": "20260929T222049Z_3bc2e63_cursor-agent_nxyt",
      "evalSlug": "evals-skill-eval-ts-house-greeting-greets-in-the-house-style-81811f",
      "attempt": "fake/plain/fake#1"
    },
    "r1/skill/fake:with-house-greeting#1": {
      "runId": "20260929T222049Z_3bc2e63_cursor-agent_nxyt",
      "evalSlug": "evals-skill-eval-ts-house-greeting-greets-in-the-house-style-81811f",
      "attempt": "fake/with-house-greeting/fake#1"
    },
    "r1/skill/broken:control#1": {
      "runId": "20260929T222049Z_3bc2e63_cursor-agent_nxyt",
      "evalSlug": "evals-skill-eval-ts-house-greeting-greets-in-the-house-style-81811f",
      "attempt": "broken/plain/fake#1"
    },
    "r1/skill/broken:with-house-greeting#1": {
      "runId": "20260929T222049Z_3bc2e63_cursor-agent_nxyt",
      "evalSlug": "evals-skill-eval-ts-house-greeting-greets-in-the-house-style-81811f",
      "attempt": "broken/with-house-greeting/fake#1"
    }
  },
  "cited": {
    "F1": "{\"kind\":\"pass-rate\",\"run\":\"r1\",\"eval\":\"greet-1\",\"cells\":[{\"cell\":\"fake:control\",\"pass\":\"1/1\",\"gated\":true},{\"cell\":\"broken:control\",\"pass\":\"0/0\",\"infraError\":1,\"gated\":true}]}"
  }
}
