{
  "kind": "reeval-analysis",
  "schemaVersion": 1,
  "scope": {
    "kind": "run",
    "head": "20260928T070748Z_37aef1d_cursor-agent_h9qy",
    "base": null,
    "evals": null
  },
  "anchor": "20260928T070748Z_37aef1d_cursor-agent_h9qy",
  "inputs": {
    "records": [
      {
        "runId": "20260928T070748Z_37aef1d_cursor-agent_h9qy",
        "sha256": "e3ea2d3b1964942edb8c959a62ce8a5726e5ffd04585ce620772edafca248c29"
      }
    ],
    "digestVersion": 1,
    "digestHash": "d4528a29b8146336a34d630cc9de15212fd2b7dc7f0537af6d32d8712892cc26"
  },
  "promptVersion": "analysis-v1",
  "model": "fake",
  "resolvedModel": "fake-analysis",
  "route": "fake",
  "usage": {
    "inputTokens": 0,
    "outputTokens": 0
  },
  "latencyMs": 10,
  "createdAt": "2026-09-28T07:07:51.864Z",
  "author": "cursor-agent",
  "validation": {
    "citations": 4,
    "invalid": [],
    "dropped": 0,
    "commands": 1,
    "invalidCommands": [],
    "unverifiedNumbers": 0
  },
  "analysis": {
    "tldr": "The house-style skill lifts the pass rate.",
    "whatHappened": [
      {
        "text": "Every eval ran on two harnesses.",
        "cites": [
          "F1"
        ],
        "confidence": "high"
      }
    ],
    "results": [
      {
        "text": "The variant passed where the control failed.",
        "cites": [
          "F1"
        ],
        "confidence": "medium"
      }
    ],
    "why": [],
    "anomalies": [
      {
        "text": "The broken harness never started.",
        "kind": "noise",
        "cites": [
          "F1"
        ]
      }
    ],
    "actions": [
      {
        "title": "Rerun the compare",
        "target": "evals/skill.es.ts",
        "kind": "eval",
        "change": "Run it three times.",
        "expectedEffect": "A tighter interval.",
        "verify": "es run skill --runs 3",
        "impact": "medium",
        "effort": "low",
        "cites": [
          "F1"
        ]
      }
    ],
    "confidence": {
      "overall": "medium",
      "why": "One run."
    }
  },
  "attempts": {
    "r1/greet-1/fake:control#1": {
      "runId": "20260928T070748Z_37aef1d_cursor-agent_h9qy",
      "evalSlug": "evals-greet-es-ts-writes-greet-js-4857ff",
      "attempt": "fake/-/fake#1"
    },
    "r1/greet-1/broken:control#1": {
      "runId": "20260928T070748Z_37aef1d_cursor-agent_h9qy",
      "evalSlug": "evals-greet-es-ts-writes-greet-js-4857ff",
      "attempt": "broken/-/fake#1"
    },
    "r1/greet-2/fake:control#1": {
      "runId": "20260928T070748Z_37aef1d_cursor-agent_h9qy",
      "evalSlug": "evals-greet-es-ts-fails-its-check-c4ea17",
      "attempt": "fake/-/fake#1"
    },
    "r1/greet-2/broken:control#1": {
      "runId": "20260928T070748Z_37aef1d_cursor-agent_h9qy",
      "evalSlug": "evals-greet-es-ts-fails-its-check-c4ea17",
      "attempt": "broken/-/fake#1"
    },
    "r1/greet-3/fake:control#1": {
      "runId": "20260928T070748Z_37aef1d_cursor-agent_h9qy",
      "evalSlug": "evals-greet-es-ts-fails-its-judge-fa3d03",
      "attempt": "fake/-/fake#1"
    },
    "r1/greet-3/broken:control#1": {
      "runId": "20260928T070748Z_37aef1d_cursor-agent_h9qy",
      "evalSlug": "evals-greet-es-ts-fails-its-judge-fa3d03",
      "attempt": "broken/-/fake#1"
    },
    "r1/greet-4/fake:control#1": {
      "runId": "20260928T070748Z_37aef1d_cursor-agent_h9qy",
      "evalSlug": "evals-greet-es-ts-is-skipped-for-now-0ff0fa",
      "attempt": "fake/-/fake#1"
    },
    "r1/greet-4/broken:control#1": {
      "runId": "20260928T070748Z_37aef1d_cursor-agent_h9qy",
      "evalSlug": "evals-greet-es-ts-is-skipped-for-now-0ff0fa",
      "attempt": "broken/-/fake#1"
    },
    "r1/greet-5/control#1": {
      "runId": "20260928T070748Z_37aef1d_cursor-agent_h9qy",
      "evalSlug": "evals-greet-es-ts-greets-in-welsh-368ddb",
      "attempt": "unknown#1"
    },
    "r1/skill/fake:control#1": {
      "runId": "20260928T070748Z_37aef1d_cursor-agent_h9qy",
      "evalSlug": "evals-skill-es-ts-house-greeting-greets-in-the-house-style-55be48",
      "attempt": "fake/-/fake#1"
    },
    "r1/skill/fake:with-house-greeting#1": {
      "runId": "20260928T070748Z_37aef1d_cursor-agent_h9qy",
      "evalSlug": "evals-skill-es-ts-house-greeting-greets-in-the-house-style-55be48",
      "attempt": "fake/with-house-greeting/fake#1"
    },
    "r1/skill/broken:control#1": {
      "runId": "20260928T070748Z_37aef1d_cursor-agent_h9qy",
      "evalSlug": "evals-skill-es-ts-house-greeting-greets-in-the-house-style-55be48",
      "attempt": "broken/-/fake#1"
    },
    "r1/skill/broken:with-house-greeting#1": {
      "runId": "20260928T070748Z_37aef1d_cursor-agent_h9qy",
      "evalSlug": "evals-skill-es-ts-house-greeting-greets-in-the-house-style-55be48",
      "attempt": "broken/with-house-greeting/fake#1"
    }
  },
  "cited": {
    "F1": "{\"kind\":\"pass-rate\",\"run\":\"r1\",\"eval\":\"greet-1\",\"cells\":[{\"cell\":\"fake:control\",\"pass\":\"1/1\",\"gated\":true},{\"cell\":\"broken:control\",\"pass\":\"0/0\",\"infraError\":1,\"gated\":true}]}"
  }
}
